{
  "document_version": "0.1-draft",
  "status": "PROPOSED_NOT_APPROVED",
  "scope": "Administrative accounting and event financial control; not fiscal/legal books",
  "rules": [
    {
      "version": 1,
      "currency_policy": "SAME_CURRENCY_ONLY; MULTICURRENCY_BLOCKED_UNTIL_APPROVED_DECISION",
      "event_scope": "SINGLE_EVENT",
      "commission_policy": "NONE_UNLESS_EXPLICITLY_STATED",
      "responsible_policy": "REQUIRES_AUTHORIZED_ACTOR_AND_AUDIT_TRAIL",
      "non_cash": false,
      "reversal_rule_code": "REVERSE_ORIGINAL_ENTRY",
      "idempotency_key_expression": "event_id + source_type + source_id + entry_kind + version",
      "blocking_decisions": [],
      "effective_from": null,
      "effective_to": null,
      "status": "PROPOSED_NOT_APPROVED",
      "rule_code": "PAYMENT_APPLIED_REGISTRATION",
      "source_type": "payment_allocation",
      "source_status": "CONFIRMED",
      "entry_kind": "REGISTRATION_REVENUE",
      "recognition_event": "confirmed payment allocation to registration",
      "debit_account_role": "FINANCIAL_ACCOUNT_BY_CHANNEL",
      "credit_account_role": "REGISTRATION_REVENUE",
      "amount_source": "applied_amount",
      "notes": "Partial allocations recognize only the allocated amount."
    },
    {
      "version": 1,
      "currency_policy": "SAME_CURRENCY_ONLY; MULTICURRENCY_BLOCKED_UNTIL_APPROVED_DECISION",
      "event_scope": "SINGLE_EVENT",
      "commission_policy": "NONE_UNLESS_EXPLICITLY_STATED",
      "responsible_policy": "REQUIRES_AUTHORIZED_ACTOR_AND_AUDIT_TRAIL",
      "non_cash": false,
      "reversal_rule_code": "REVERSE_ORIGINAL_ENTRY",
      "idempotency_key_expression": "event_id + source_type + source_id + entry_kind + version",
      "blocking_decisions": [],
      "effective_from": null,
      "effective_to": null,
      "status": "PROPOSED_NOT_APPROVED",
      "rule_code": "PAYMENT_APPLIED_LODGING",
      "source_type": "payment_allocation",
      "source_status": "CONFIRMED",
      "entry_kind": "LODGING_REVENUE",
      "recognition_event": "confirmed payment allocation to lodging",
      "debit_account_role": "FINANCIAL_ACCOUNT_BY_CHANNEL",
      "credit_account_role": "LODGING_REVENUE",
      "amount_source": "applied_amount",
      "notes": ""
    },
    {
      "version": 1,
      "currency_policy": "SAME_CURRENCY_ONLY; MULTICURRENCY_BLOCKED_UNTIL_APPROVED_DECISION",
      "event_scope": "SINGLE_EVENT",
      "commission_policy": "NONE_UNLESS_EXPLICITLY_STATED",
      "responsible_policy": "REQUIRES_AUTHORIZED_ACTOR_AND_AUDIT_TRAIL",
      "non_cash": false,
      "reversal_rule_code": "REVERSE_ORIGINAL_ENTRY",
      "idempotency_key_expression": "event_id + source_type + source_id + entry_kind + version",
      "blocking_decisions": [],
      "effective_from": null,
      "effective_to": null,
      "status": "PROPOSED_NOT_APPROVED",
      "rule_code": "PAYMENT_APPLIED_TRANSPORT",
      "source_type": "payment_allocation",
      "source_status": "CONFIRMED",
      "entry_kind": "TRANSPORT_REVENUE",
      "recognition_event": "confirmed payment allocation to transport",
      "debit_account_role": "FINANCIAL_ACCOUNT_BY_CHANNEL",
      "credit_account_role": "TRANSPORT_REVENUE",
      "amount_source": "applied_amount",
      "notes": ""
    },
    {
      "version": 1,
      "currency_policy": "SAME_CURRENCY_ONLY; MULTICURRENCY_BLOCKED_UNTIL_APPROVED_DECISION",
      "event_scope": "SINGLE_EVENT",
      "commission_policy": "NONE_UNLESS_EXPLICITLY_STATED",
      "responsible_policy": "REQUIRES_AUTHORIZED_ACTOR_AND_AUDIT_TRAIL",
      "non_cash": false,
      "reversal_rule_code": "REVERSE_ORIGINAL_ENTRY",
      "idempotency_key_expression": "event_id + source_type + source_id + entry_kind + version",
      "blocking_decisions": [
        "OVERPAYMENT_AND_REFUND_POLICY"
      ],
      "effective_from": null,
      "effective_to": null,
      "status": "PROPOSED_NOT_APPROVED",
      "rule_code": "PAYMENT_UNAPPLIED_ADVANCE",
      "source_type": "payment",
      "source_status": "CONFIRMED_UNAPPLIED",
      "entry_kind": "PARTICIPANT_ADVANCE",
      "recognition_event": "confirmed payment with no final allocation",
      "debit_account_role": "FINANCIAL_ACCOUNT_BY_CHANNEL",
      "credit_account_role": "PARTICIPANT_ADVANCES",
      "amount_source": "unapplied_amount",
      "notes": "Overpayments remain liabilities, not revenue."
    },
    {
      "version": 1,
      "currency_policy": "SAME_CURRENCY_ONLY; MULTICURRENCY_BLOCKED_UNTIL_APPROVED_DECISION",
      "event_scope": "SINGLE_EVENT",
      "commission_policy": "NONE_UNLESS_EXPLICITLY_STATED",
      "responsible_policy": "REQUIRES_AUTHORIZED_ACTOR_AND_AUDIT_TRAIL",
      "non_cash": false,
      "reversal_rule_code": "REVERSE_ORIGINAL_ENTRY",
      "idempotency_key_expression": "event_id + source_type + source_id + entry_kind + version",
      "blocking_decisions": [
        "OVERPAYMENT_AND_REFUND_POLICY"
      ],
      "effective_from": null,
      "effective_to": null,
      "status": "PROPOSED_NOT_APPROVED",
      "rule_code": "ADVANCE_APPLIED_TO_REVENUE",
      "source_type": "payment_allocation",
      "source_status": "APPROVED_FROM_ADVANCE",
      "entry_kind": "ADVANCE_APPLICATION",
      "recognition_event": "approved allocation of existing participant advance",
      "debit_account_role": "PARTICIPANT_ADVANCES",
      "credit_account_role": "REVENUE_ROLE_BY_CONCEPT",
      "amount_source": "applied_amount",
      "notes": "Does not debit cash again."
    },
    {
      "version": 1,
      "currency_policy": "SAME_CURRENCY_ONLY; MULTICURRENCY_BLOCKED_UNTIL_APPROVED_DECISION",
      "event_scope": "SINGLE_EVENT",
      "commission_policy": "NONE_UNLESS_EXPLICITLY_STATED",
      "responsible_policy": "REQUIRES_AUTHORIZED_ACTOR_AND_AUDIT_TRAIL",
      "non_cash": false,
      "reversal_rule_code": "REVERSE_ORIGINAL_ENTRY",
      "idempotency_key_expression": "event_id + source_type + source_id + entry_kind + version",
      "blocking_decisions": [],
      "effective_from": null,
      "effective_to": null,
      "status": "PROPOSED_NOT_APPROVED",
      "rule_code": "MONETARY_DONATION_RECEIVED",
      "source_type": "monetary_donation",
      "source_status": "CONFIRMED_RECEIVED",
      "entry_kind": "MONETARY_DONATION",
      "recognition_event": "confirmed receipt of monetary donation",
      "debit_account_role": "FINANCIAL_ACCOUNT_BY_CHANNEL",
      "credit_account_role": "MONETARY_DONATION_REVENUE",
      "amount_source": "received_amount",
      "notes": ""
    },
    {
      "version": 1,
      "currency_policy": "SAME_CURRENCY_ONLY; MULTICURRENCY_BLOCKED_UNTIL_APPROVED_DECISION",
      "event_scope": "SINGLE_EVENT",
      "commission_policy": "NONE_UNLESS_EXPLICITLY_STATED",
      "responsible_policy": "REQUIRES_AUTHORIZED_ACTOR_AND_AUDIT_TRAIL",
      "non_cash": true,
      "reversal_rule_code": "REVERSE_ORIGINAL_ENTRY",
      "idempotency_key_expression": "event_id + source_type + source_id + entry_kind + version",
      "blocking_decisions": [
        "IN_KIND_VALUATION_POLICY"
      ],
      "effective_from": null,
      "effective_to": null,
      "status": "PROPOSED_NOT_APPROVED",
      "rule_code": "IN_KIND_DONATION_INVENTORY",
      "source_type": "in_kind_donation",
      "source_status": "APPROVED_RECEIVED",
      "entry_kind": "IN_KIND_INVENTORY_DONATION",
      "recognition_event": "approved valuation and receipt of consumable goods",
      "debit_account_role": "INVENTORY",
      "credit_account_role": "IN_KIND_DONATION_REVENUE",
      "amount_source": "approved_valuation",
      "notes": ""
    },
    {
      "version": 1,
      "currency_policy": "SAME_CURRENCY_ONLY; MULTICURRENCY_BLOCKED_UNTIL_APPROVED_DECISION",
      "event_scope": "SINGLE_EVENT",
      "commission_policy": "NONE_UNLESS_EXPLICITLY_STATED",
      "responsible_policy": "REQUIRES_AUTHORIZED_ACTOR_AND_AUDIT_TRAIL",
      "non_cash": true,
      "reversal_rule_code": "REVERSE_ORIGINAL_ENTRY",
      "idempotency_key_expression": "event_id + source_type + source_id + entry_kind + version",
      "blocking_decisions": [
        "IN_KIND_VALUATION_POLICY"
      ],
      "effective_from": null,
      "effective_to": null,
      "status": "PROPOSED_NOT_APPROVED",
      "rule_code": "IN_KIND_DONATION_SERVICE",
      "source_type": "service_donation",
      "source_status": "APPROVED_RECEIVED",
      "entry_kind": "IN_KIND_SERVICE_DONATION",
      "recognition_event": "approved valuation and acceptance of donated service",
      "debit_account_role": "OPERATING_EXPENSE_BY_SERVICE",
      "credit_account_role": "IN_KIND_DONATION_REVENUE",
      "amount_source": "approved_valuation",
      "notes": ""
    },
    {
      "version": 1,
      "currency_policy": "SAME_CURRENCY_ONLY; MULTICURRENCY_BLOCKED_UNTIL_APPROVED_DECISION",
      "event_scope": "SINGLE_EVENT",
      "commission_policy": "NONE_UNLESS_EXPLICITLY_STATED",
      "responsible_policy": "REQUIRES_AUTHORIZED_ACTOR_AND_AUDIT_TRAIL",
      "non_cash": false,
      "reversal_rule_code": "REVERSE_ORIGINAL_ENTRY",
      "idempotency_key_expression": "event_id + source_type + source_id + entry_kind + version",
      "blocking_decisions": [],
      "effective_from": null,
      "effective_to": null,
      "status": "PROPOSED_NOT_APPROVED",
      "rule_code": "PURCHASE_PAID_IMMEDIATELY",
      "source_type": "purchase",
      "source_status": "APPROVED_PAID",
      "entry_kind": "PURCHASE_CASH",
      "recognition_event": "approved and paid purchase",
      "debit_account_role": "EXPENSE_INVENTORY_OR_ASSET_BY_ITEM",
      "credit_account_role": "FINANCIAL_ACCOUNT_BY_CHANNEL",
      "amount_source": "approved_total",
      "notes": ""
    },
    {
      "version": 1,
      "currency_policy": "SAME_CURRENCY_ONLY; MULTICURRENCY_BLOCKED_UNTIL_APPROVED_DECISION",
      "event_scope": "SINGLE_EVENT",
      "commission_policy": "NONE_UNLESS_EXPLICITLY_STATED",
      "responsible_policy": "REQUIRES_AUTHORIZED_ACTOR_AND_AUDIT_TRAIL",